{
  "schema_version": "0.1.0",
  "run_id": "run_minimal_001",
  "workflow_ref": {
    "workflow_id": "wf_minimal_contract",
    "workflow_version": "0.1.0",
    "revision": "rev_001",
    "digest": "bbbbbbbbbbbbbbbbbbbbbbbbbbbbbbbbbbbbbbbbbbbbbbbbbbbbbbbbbbbbbbbb"
  },
  "status": "READY",
  "node_runs": [],
  "attempt_count": 0,
  "budget": {
    "max_duration_seconds": 300,
    "elapsed_seconds": 0,
    "max_transitions": 20,
    "used_transitions": 0,
    "max_tool_calls": 0,
    "used_tool_calls": 0
  },
  "artifact_refs": [],
  "last_event_sequence": 0,
  "created_at": "2026-07-31T16:00:00+08:00",
  "updated_at": "2026-07-31T16:00:00+08:00",
  "metadata": {
    "labels": {
      "fixture": "valid"
    }
  }
}
